{
  "id": "marketing.social.linkedin.company-banner.default",
  "title": "LinkedIn company banner",
  "assetType": "social-banner",
  "subtype": "cover",
  "status": "approved",
  "maturity": "ga",
  "brand": "acme",
  "channels": [
    "linkedin"
  ],
  "usageContexts": [
    "company-profile-cover"
  ],
  "owners": {
    "design": "marketing-design",
    "engineering": "growth-ops"
  },
  "sourceOfTruth": {
    "tool": "Figma",
    "location": "Marketing / Social / LinkedIn"
  },
  "editableMasters": [
    "source/social/linkedin/company-banner.fig"
  ],
  "tokenRefs": [
    "color.background.brand.default",
    "color.text.inverse"
  ],
  "themes": [
    "light",
    "dark"
  ],
  "locales": [
    "global",
    "en-US"
  ],
  "dimensions": {
    "w": 1584,
    "h": 396,
    "ratio": "4:1"
  },
  "formatProfiles": [
    "png-social-2x",
    "jpg-social"
  ],
  "accessibility": {
    "altText": "Acme LinkedIn company banner",
    "wcagTarget": "WCAG 2.2 AA",
    "notes": [
      "Keep essential text inside the center safe area.",
      "Headline text must remain readable in mobile crops."
    ]
  },
  "version": "1.3.0",
  "changeType": "minor"
}
